{
  "$schema": "../schemas/cv.schema.json",
  "lang": "es",
  "contact": {
    "name": "Emanuel Ignacio Arias",
    "titles": [
      "Project Leader",
      "Engineering Manager",
      "Technical Program Manager"
    ],
    "location": "Tandil, Buenos Aires, Argentina",
    "phone": "+54 9 15 3765 7844",
    "email": "arias.emanuel@gmail.com",
    "linkedin": "https://www.linkedin.com/in/ariasemanuel"
  },
  "professionalSummary": [
    {
      "text": "Project Leader con más de 10 años de experiencia en el SDLC, liderando squads cross-funcionales en Mercado Libre para sistemas con picos de 20,000+ RPM — experto en liderazgo Agile, alineación de stakeholders y delivery management.",
      "tags": ["sdlc", "agile", "delivery-management", "high-scale"]
    },
    {
      "text": "Construí un motor de debugging que redujo el backlog de incidentes un 70% y el tiempo de RCA de ~2 horas a ~30 minutos; implementé automatizaciones con n8n + AI, recuperando ~18–20 horas/semana de capacidad de ingeniería.",
      "tags": ["automation", "debugging", "ai", "n8n", "incident-management"]
    },
    {
      "text": "Mentoreé squads de hasta 9 ingenieros, logrando 4 promociones en 18 meses, mientras lideraba la entrega end-to-end de programas cross-funcionales complejos que requirieron negociar cambios arquitectónicos fundacionales.",
      "tags": ["mentoring", "leadership", "cross-functional", "architecture"]
    }
  ],
  "coreCompetencies": [
    {
      "title": "Technical Program & Delivery Management",
      "description": "Más de 5 años liderando la entrega end-to-end de programas técnicos cross-funcionales, definiendo roadmaps, milestones y success criteria alineados con objetivos de negocio multi-quarter. Experto en desglosar epics en historias técnicas, gestionar dependencias y coordinar la ejecución entre equipos de UX, Producto, Comercial y Arquitectura.",
      "tags": ["delivery-management", "roadmap", "cross-functional", "stakeholder-alignment"]
    },
    {
      "title": "Liderazgo Agile & Optimización de Procesos",
      "description": "Más de 3 años como Scrum Master liderando sprint planning, alineación trimestral de roadmap y ceremonias Agile para squads de hasta 9 personas. Modernicé modelos operativos reestructurando flujos de Jira y aplicando automatización con IA, eliminando cuellos de botella administrativos y mejorando la velocidad de entrega.",
      "tags": ["agile", "scrum", "process-optimization", "jira", "ai"]
    },
    {
      "title": "Ingeniería de Sistemas & Automatización",
      "description": "Sólido pensamiento sistémico aplicado a arquitecturas de alta escala (20,000+ RPM). Diseñé e implementé un Shadow Processing & Debugging Engine para gestión de incidentes a escala. Implementé flujos automatizados con n8n y AI para planificación de sprints, creación de tickets, documentación y scheduling.",
      "tags": ["systems-engineering", "automation", "high-scale", "n8n", "debugging"]
    },
    {
      "title": "Desarrollo de Equipos & Mentoría",
      "description": "Mentoreé a 9 ingenieros en distintos niveles, facilitando decisiones arquitectónicas, aplicando estándares de calidad de código y gestionando el crecimiento profesional — resultando en 4 promociones (Jr a SSR, SSR a Sr, Sr a TL). Construí una cultura de equipo positiva enfocada en mejora continua y ownership.",
      "tags": ["mentoring", "team-development", "code-quality", "ownership", "promotions"]
    }
  ],
  "skills": [
    {
      "category": "Program & Delivery Management",
      "items": [
        "Agile Leadership (Scrum/Kanban)",
        "Roadmap Planning",
        "Stakeholder Management",
        "Risk Mitigation",
        "SDLC Optimization",
        "KPI Tracking",
        "Delivery Management",
        "Backlog Management",
        "Dependency Management",
        "Epic Breakdown"
      ]
    },
    {
      "category": "Background Técnico",
      "items": [
        "High-Concurrency Distributed Systems",
        "Microservices Architecture",
        "REST API Design",
        "Java Ecosystem",
        "Cloud Infrastructure (AWS)",
        "Docker",
        "CI/CD",
        "OAuth"
      ]
    },
    {
      "category": "Automatización & Herramientas",
      "items": [
        "n8n (Workflow Automation)",
        "AI Copilots",
        "Jira",
        "GitHub",
        "Confluence",
        "Datadog/New Relic (Observability)"
      ]
    },
    {
      "category": "Bases de Datos",
      "items": [
        "MySQL",
        "CouchDB",
        "MongoDB",
        "Relational Data Modeling"
      ]
    }
  ],
  "professionalExperience": [
    {
      "id": "299263f4-ded2-4e85-9fff-2183fd0c48f8",
      "company": "Mercado Libre",
      "role": "Project Leader",
      "location": "Argentina",
      "dates": {
        "start": "2023-01",
        "end": "2025-11"
      },
      "description": "Lideré un squad cross-funcional de 9 personas (7 Developers, 2 Technical Leaders) responsable de APIs críticas del Marketplace con picos de tráfico de 20,000+ RPM.",
      "achievements": [
        {
          "id": "e13985dd-e1fd-41ab-8774-1e76712259e9",
          "text": "Lideré la entrega end-to-end del programa técnico 'Product Bundles' — una iniciativa compleja para habilitar la venta combinada de productos a escala. Definí milestones, success criteria y roadmap multi-quarter; coordiné la alineación cross-funcional entre equipos de UX, Producto, Comercial y Core Architecture, negociando modificaciones a entidades fundacionales de inventario y gestionando dependencias entre 3 sistemas backend (Inventory, Catalog, Checkout).",
          "metrics": [
            {
              "type": "other",
              "value": "[NEEDS METRIC: program scope, e.g. revenue impact or SKUs bundled]"
            }
          ],
          "technologies": ["Jira"],
          "domains": ["delivery-management", "leadership"],
          "impact": "high",
          "tags": ["cross-functional", "roadmap", "stakeholder-alignment", "e-commerce"]
        },
        {
          "id": "69f06915-ec94-43b2-b39d-05d1c6e8ba22",
          "text": "Diseñé e implementé un Shadow Processing & Debugging Engine para un pipeline de eventos de alta frecuencia con 20,000+ RPM. Construí un business case basado en datos que superó la resistencia inicial al scope; el motor permitió inspección de tráfico en tiempo real sin bloquear producción, reduciendo el backlog de incidentes un 70% y el tiempo de RCA de ~2 horas a ~30 minutos.",
          "metrics": [
            {
              "type": "percentage-improvement",
              "value": "70"
            },
            {
              "type": "time-reduction",
              "value": "120min → 30min"
            }
          ],
          "technologies": [],
          "domains": ["backend-engineering", "automation"],
          "impact": "high",
          "tags": ["debugging", "incident-management", "rca", "high-throughput"]
        },
        {
          "id": "710cbd38-4597-46e6-ae14-907f0afe9c37",
          "text": "Modernicé el modelo operativo del squad actuando como Scrum Master, reestructurando flujos de Jira e implementando n8n + AI copilots para automatizar sprint planning, creación de epics/stories/tasks, estimaciones, scheduling y documentación. Recuperé ~18–20 horas/semana de capacidad de ingeniería (~2h/dev + 4h liderazgo), mejorando la precisión de forecasts y la velocidad de entrega.",
          "metrics": [
            {
              "type": "time-reduction",
              "value": "18-20 hours/week"
            }
          ],
          "technologies": ["n8n", "AI", "Jira"],
          "domains": ["automation", "delivery-management", "leadership"],
          "impact": "high",
          "tags": ["scrum-master", "workflow-automation", "jira", "sprint-planning"]
        },
        {
          "id": "c512f0ab-e4bd-4f99-ba59-8e0fd8aa516d",
          "text": "Mentoreé a 9 ingenieros en distintos niveles, facilitando decisiones arquitectónicas para soluciones de alto tráfico, promoviendo prácticas de calidad de código y protegiendo al equipo del scope creep mediante priorización estricta del roadmap. Logré 4 promociones en 18 meses (Jr a SSR, SSR a Sr, Sr a TL), construyendo capacidad del equipo y una cultura de ownership.",
          "metrics": [
            {
              "type": "team-size",
              "value": "9"
            },
            {
              "type": "other",
              "value": "4 promotions in 18 months"
            }
          ],
          "technologies": [],
          "domains": ["leadership", "delivery-management"],
          "impact": "high",
          "tags": ["mentoring", "promotions", "architecture", "code-quality", "growth"]
        }
      ],
      "tags": ["high-scale", "e-commerce", "marketplace", "latam"]
    },
    {
      "id": "f5965709-fe37-4141-b105-8cfdc40272c2",
      "company": "Mercado Libre",
      "role": "Senior Software Engineer",
      "location": "Argentina",
      "dates": {
        "start": "2021-07",
        "end": "2023-01"
      },
      "achievements": [
        {
          "id": "6b596452-75ac-4540-a701-9484b9872299",
          "text": "Diseñé e implementé servicios backend escalables en Java para componentes del Marketplace con cargas pico de 20,000+ RPM. Apliqué principios SOLID y mejores prácticas de REST API para construir capas de servicio mantenibles y testables.",
          "metrics": [
            {
              "type": "other",
              "value": "[NEEDS METRIC: system throughput handled or services deployed]"
            }
          ],
          "technologies": ["Java", "REST API", "SOLID"],
          "domains": ["backend-engineering"],
          "impact": "medium",
          "tags": ["java", "rest", "solid", "high-throughput"]
        },
        {
          "id": "7256cbe4-9876-4901-b449-c49294cc2e95",